--------[ AIDA64 Extreme ]----------------------------------------------------------------------------------------------

    Версия                                            AIDA64 v5.75.3900/ru
    Тестовый модуль                                   4.2.685-x64
    Домашняя страница                                 http://www.aida64.com/
    Тип отчёта                                        Мастер отчётов
    Компьютер                                         ALEXSKS
    Генератор                                         admin
    Операционная система                              Microsoft Windows 10 Pro 10.0.19044.1706
    Дата                                              2022-05-22
    Время                                             20:44


--------[ Суммарная информация ]----------------------------------------------------------------------------------------

    Компьютер:
      Тип компьютера                                    Компьютер с ACPI на базе x64
      Операционная система                              Microsoft Windows 10 Pro
      Пакет обновления ОС                               -
      Internet Explorer                                 11.789.19041.0
      Edge                                              44.19041.1266.0
      DirectX                                           DirectX 12.0
      Имя компьютера                                    ALEXSKS
      Имя пользователя                                  admin
      Вход в домен                                      ALEXSKS
      Дата / Время                                      2022-05-22 / 20:44

    Системная плата:
      Тип ЦП                                            QuadCore Intel Core i5-2400, 3300 MHz (33 x 100)
      Системная плата                                   Asus P8H77-M  (1 PCI, 1 PCI-E x1, 2 PCI-E x16, 4 DDR3 DIMM, Audio, Video, Gigabit LAN)
      Чипсет системной платы                            Intel Panther Point H77, Intel Sandy Bridge
      Системная память                                  12240 МБ  (DDR3 SDRAM)
      DIMM1: Samsung M378B5273DH0-CH9                   4 ГБ DDR3-1333 DDR3 SDRAM  (9-9-9-24 @ 666 МГц)  (8-8-8-22 @ 609 МГц)  (7-7-7-20 @ 533 МГц)  (6-6-6-17 @ 457 МГц)
      DIMM2: Samsung M378B5773DH0-CH9                   2 ГБ DDR3-1333 DDR3 SDRAM  (9-9-9-24 @ 666 МГц)  (8-8-8-22 @ 609 МГц)  (7-7-7-20 @ 533 МГц)  (6-6-6-17 @ 457 МГц)
      DIMM3: Wilk Elektronik GR1600D3V64L11/4G          4 ГБ DDR3-1600 DDR3 SDRAM  (11-11-11-28 @ 800 МГц)  (10-10-10-27 @ 761 МГц)  (9-9-9-24 @ 685 МГц)  (8-8-8-22 @ 609 МГц)  (7-7-7-19 @ 533 МГц)  (6-6-6-16 @ 457 МГц)  (5-5-5-14 @ 380 МГц)
      DIMM4: Samsung M378B5773DH0-CH9                   2 ГБ DDR3-1333 DDR3 SDRAM  (9-9-9-24 @ 666 МГц)  (8-8-8-22 @ 609 МГц)  (7-7-7-20 @ 533 МГц)  (6-6-6-17 @ 457 МГц)
      Тип BIOS                                          AMI (07/27/2012)
      Коммуникационный порт                             Последовательный порт (COM1)
      Коммуникационный порт                             Порт принтера (LPT1)

    Отображение:
      Видеоадаптер                                      GeForce GTX 550 Ti  (1 ГБ)
      Видеоадаптер                                      GeForce GTX 550 Ti  (1 ГБ)
      3D-акселератор                                    nVIDIA GeForce GTX 550 Ti
      Монитор                                           BenQ G2222HDL (Analog)  [22" LCD]  (WCA02882026)

    Мультимедиа:
      Звуковой адаптер                                  nVIDIA HDMI/DP @ nVIDIA GF116 - High Definition Audio Controller
      Звуковой адаптер                                  nVIDIA HDMI/DP @ nVIDIA GF116 - High Definition Audio Controller
      Звуковой адаптер                                  nVIDIA HDMI/DP @ nVIDIA GF116 - High Definition Audio Controller
      Звуковой адаптер                                  nVIDIA HDMI/DP @ nVIDIA GF116 - High Definition Audio Controller
      Звуковой адаптер                                  Realtek ALC887 @ Intel Panther Point PCH - High Definition Audio Controller [C-1]

    Хранение данных:
      IDE-контроллер                                    Стандартный двухканальный контроллер PCI IDE
      IDE-контроллер                                    Стандартный двухканальный контроллер PCI IDE
      Контроллер хранения данных                        Контроллер дискового пространства (Майкрософт)
      Дисковый накопитель                               ADATA SU635 ATA Device  (223 ГБ, IDE)
      Дисковый накопитель                               WDC WD10EZEX-08M2NA0 ATA Device  (1 ТБ, 7200 RPM, SATA-III)
      Оптический накопитель                             Optiarc DVD RW AD-7260S ATA Device  (DVD+R9:12x, DVD-R9:12x, DVD+RW:24x/8x, DVD-RW:24x/6x, DVD-RAM:12x, DVD-ROM:16x, CD:48x/32x/48x DVD+RW/DVD-RW/DVD-RAM)
      SMART-статус жёстких дисков                       OK

    Разделы:
      C: (NTFS)                                         223.0 ГБ (165.1 ГБ свободно)
      D: (NTFS)                                         736.2 ГБ (148.2 ГБ свободно)
      F: (NTFS)                                         194.3 ГБ (68.2 ГБ свободно)
      G: (FAT32)                                        15360 МБ (1360 МБ свободно)
      Общий объём                                       1168.5 ГБ (382.9 ГБ свободно)

    Ввод:
      Клавиатура                                        Клавиатура HID
      Мышь                                              HID-совместимая мышь

    Сеть:
      Первичный адрес IP                                192.168.1.246
      Первичный адрес MAC                               30-85-A9-9A-DA-EA
      Сетевой адаптер                                   Realtek PCIe GbE Family Controller  (192.168.1.246)

    Периферийные устройства:
      Принтер                                           Fax
      Принтер                                           Microsoft Print to PDF
      Принтер                                           Microsoft XPS Document Writer
      Принтер                                           OneNote for Windows 10
      Принтер                                           Отправить в OneNote 16
      Контроллер USB2                                   Intel Panther Point PCH - USB 2.0 EHCI Controller #1 [C-1]
      Контроллер USB2                                   Intel Panther Point PCH - USB 2.0 EHCI Controller #2 [C-1]
      Контроллер USB3                                   Intel Panther Point PCH - USB 3.0 xHCI Controller [C-1]
      USB-устройство                                    Generic USB Hub
      USB-устройство                                    Generic USB Hub
      USB-устройство                                    Generic USB Hub
      USB-устройство                                    Logitech USB Input Device
      USB-устройство                                    Microsoft LifeChat LX-4000
      USB-устройство                                    USB-устройство ввода
      USB-устройство                                    USB-устройство ввода
      USB-устройство                                    USB-устройство ввода
      USB-устройство                                    Составное USB устройство
      USB-устройство                                    Составное USB устройство

    DMI:
      DMI поставщик BIOS                                American Megatrends Inc.
      DMI версия BIOS                                   0606
      DMI производитель системы                         System manufacturer
      DMI система                                       System Product Name
      DMI системная версия                              System Version
      DMI системный серийный номер                      System Serial Number
      DMI системный UUID                                4073172B-DAD7DD11-84793085-A99ADAEA
      DMI производитель системной платы                 ASUSTeK COMPUTER INC.
      DMI системная плата                               P8H77-M
      DMI версия системной платы                        Rev X.0x
      DMI серийный номер системной платы                120801434404012
      DMI производитель шасси                           Chassis Manufacture
      DMI версия шасси                                  Chassis Version
      DMI серийный номер шасси                          Chassis Serial Number
      DMI Asset-тег шасси                               Asset-1234567890
      DMI тип шасси                                     Desktop Case


--------[ Debug - PCI ]-------------------------------------------------------------------------------------------------

    B00 D00 F00:  Intel Sandy Bridge-DT - Host Bridge/DRAM Controller
                  
      Offset 000:  86 80 00 01  06 00 90 20  09 00 00 06  00 00 00 00 
      Offset 010:  00 00 00 00  00 00 00 00  00 00 00 00  00 00 00 00 
      Offset 020:  00 00 00 00  00 00 00 00  00 00 00 00  43 10 CA 84 
      Offset 030:  00 00 00 00  E0 00 00 00  00 00 00 00  00 00 00 00 
      Offset 040:  01 90 D1 FE  00 00 00 00  01 00 D1 FE  00 00 00 00 
      Offset 050:  03 00 00 00  09 00 00 00  00 00 00 00  01 00 00 DF 
      Offset 060:  05 00 00 F8  00 00 00 00  01 80 D1 FE  00 00 00 00 
      Offset 070:  00 00 00 FF  02 00 00 00  00 0C 00 FF  7F 00 00 00 
      Offset 080:  10 11 11 00  00 00 11 00  1A 00 00 00  00 00 00 00 
      Offset 090:  01 00 00 FF  02 00 00 00  01 00 F0 1E  03 00 00 00 
      Offset 0A0:  01 00 00 00  03 00 00 00  01 00 00 1F  03 00 00 00 
      Offset 0B0:  01 00 00 E0  01 00 00 E0  01 00 00 DF  01 00 00 E0 
      Offset 0C0:  00 00 00 00  00 00 00 00  00 00 00 00  00 00 00 00 
      Offset 0D0:  00 00 00 00  00 00 00 00  00 00 00 00  00 00 00 00 
      Offset 0E0:  09 00 0C 01  96 A0 00 E2  90 00 00 04  00 00 00 00 
      Offset 0F0:  00 00 00 00  00 00 00 00  B8 0F 06 00  00 00 00 00 

    B00 D01 F00:  Intel Sandy Bridge - PCI Express Controller
                  
      Offset 000:  86 80 01 01  07 04 10 00  09 00 04 06  10 00 81 00 
      Offset 010:  00 00 00 00  00 00 00 00  00 01 01 00  E0 E0 00 20 
      Offset 020:  00 F4 00 F6  01 E0 F1 EB  00 00 00 00  00 00 00 00 
      Offset 030:  00 00 00 00  88 00 00 00  00 00 00 00  0B 01 18 00 
      Offset 040:  00 00 00 00  00 00 00 00  00 00 00 00  00 00 00 00 
      Offset 050:  00 00 00 00  00 00 00 00  00 00 00 00  00 00 00 00 
      Offset 060:  00 00 00 00  00 00 00 00  00 00 00 00  00 00 00 00 
      Offset 070:  00 00 00 00  00 00 00 00  00 00 00 00  00 00 00 0A 
      Offset 080:  01 90 03 C8  08 00 00 00  0D 80 00 00  43 10 CA 84 
      Offset 090:  05 A0 00 00  00 00 00 00  00 00 00 00  00 00 00 00 
      Offset 0A0:  10 00 42 01  00 80 00 00  00 00 00 00  02 2D 21 02 
      Offset 0B0:  40 00 01 51  80 25 0C 00  00 00 40 00  00 00 00 00 
      Offset 0C0:  00 00 00 00  00 08 00 00  00 00 00 00  00 00 00 00 
      Offset 0D0:  42 00 00 00  00 00 00 00  00 00 00 00  00 00 00 00 
      Offset 0E0:  00 00 00 00  00 00 00 00  00 00 00 00  00 00 00 00 
      Offset 0F0:  00 00 00 00  00 00 01 00  00 00 00 00  00 00 10 00 

    B00 D14 F00:  Intel Panther Point PCH - USB 3.0 xHCI Controller [C-1]
                  
      Offset 000:  86 80 31 1E  06 04 90 02  04 30 03 0C  00 00 00 00 
      Offset 010:  04 00 10 F6  00 00 00 00  00 00 00 00  00 00 00 00 
      Offset 020:  00 00 00 00  00 00 00 00  00 00 00 00  43 10 CA 84 
      Offset 030:  00 00 00 00  70 00 00 00  00 00 00 00  00 01 00 00 
      Offset 040:  FD 07 0E 80  39 C2 03 80  00 00 00 00  00 00 00 00 
      Offset 050:  17 00 00 00  00 00 00 00  00 00 00 00  00 00 00 00 
      Offset 060:  30 20 00 00  00 00 00 00  00 00 00 00  00 00 00 00 
      Offset 070:  01 80 C2 C1  08 00 00 00  00 00 00 00  00 00 00 00 
      Offset 080:  05 00 87 00  F8 01 E0 FE  00 00 00 00  00 00 00 00 
      Offset 090:  00 00 00 00  00 00 00 00  00 00 00 00  00 00 00 00 
      Offset 0A0:  00 00 00 00  00 00 00 00  00 00 00 00  00 00 00 00 
      Offset 0B0:  8F 00 00 00  00 00 00 00  00 00 00 00  00 00 00 00 
      Offset 0C0:  03 0C 00 00  00 00 00 00  00 00 00 00  00 00 00 00 
      Offset 0D0:  0F 00 00 00  0F 00 00 00  0F 00 00 00  0F 00 00 00 
      Offset 0E0:  00 00 00 00  00 00 00 00  00 00 00 00  00 00 00 00 
      Offset 0F0:  00 00 00 00  00 00 00 00  87 0F 04 08  00 00 00 00 

    B00 D16 F00:  Intel Panther Point PCH - Host Embedded Controller Interface 1 (HECI1) [C-1]
                  
      Offset 000:  86 80 3A 1E  06 04 10 00  04 00 80 07  00 00 80 00 
      Offset 010:  04 90 11 F6  00 00 00 00  00 00 00 00  00 00 00 00 
      Offset 020:  00 00 00 00  00 00 00 00  00 00 00 00  43 10 CA 84 
      Offset 030:  00 00 00 00  50 00 00 00  00 00 00 00  00 01 00 00 
      Offset 040:  55 02 00 1E  10 00 01 80  06 01 00 60  F0 2F 00 10 
      Offset 050:  01 8C 03 C8  08 00 00 00  00 00 00 00  00 00 00 00 
      Offset 060:  00 00 00 00  00 00 00 00  00 00 00 00  00 00 00 00 
      Offset 070:  00 00 00 00  00 00 00 00  00 00 00 00  00 00 00 00 
      Offset 080:  00 00 00 00  00 00 00 00  00 00 00 00  05 00 81 00 
      Offset 090:  18 02 E0 FE  00 00 00 00  00 00 00 00  00 00 00 00 
      Offset 0A0:  00 00 00 00  00 00 00 00  00 00 00 00  00 00 00 00 
      Offset 0B0:  00 00 00 00  00 00 00 00  00 00 00 00  02 00 00 C0 
      Offset 0C0:  6D 08 C5 89  D6 68 5C 98  B4 25 77 81  1C 6D E9 6C 
      Offset 0D0:  AE 8B 96 2F  B5 7E D7 63  92 9A 9B BD  04 FD 0F 92 
      Offset 0E0:  00 00 00 00  00 00 00 00  00 00 00 00  00 00 00 00 
      Offset 0F0:  00 00 00 00  00 00 00 00  00 00 00 00  00 00 00 00 

    B00 D1A F00:  Intel Panther Point PCH - USB 2.0 EHCI Controller #2 [C-1]
                  
      Offset 000:  86 80 2D 1E  06 00 90 02  04 20 03 0C  00 00 00 00 
      Offset 010:  00 70 11 F6  00 00 00 00  00 00 00 00  00 00 00 00 
      Offset 020:  00 00 00 00  00 00 00 00  00 00 00 00  43 10 CA 84 
      Offset 030:  00 00 00 00  50 00 00 00  00 00 00 00  17 01 00 00 
      Offset 040:  00 00 00 00  00 00 00 00  00 00 00 00  00 00 00 00 
      Offset 050:  01 58 C2 C9  00 00 00 00  0A 98 A0 20  00 00 00 00 
      Offset 060:  20 20 81 07  00 00 00 00  01 00 00 01  00 20 00 00 
      Offset 070:  00 00 FF 3F  00 00 00 00  00 00 00 00  00 00 00 00 
      Offset 080:  00 00 80 00  11 88 0C 93  30 0D 00 24  00 00 00 00 
      Offset 090:  00 00 00 00  00 00 00 00  13 00 06 03  00 00 00 00 
      Offset 0A0:  00 00 00 00  00 00 00 00  00 00 00 00  00 00 00 00 
      Offset 0B0:  00 00 00 00  00 00 00 00  00 00 00 00  00 00 00 00 
      Offset 0C0:  00 00 00 00  00 00 00 00  00 00 00 00  00 00 00 00 
      Offset 0D0:  00 00 00 00  00 AA FF 00  00 00 00 00  00 00 00 00 
      Offset 0E0:  00 00 00 00  A0 20 00 24  00 1A 08 20  40 78 51 2D 
      Offset 0F0:  00 00 00 00  88 85 80 00  87 0F 04 08  08 17 5B 20 

    B00 D1B F00:  Intel Panther Point PCH - High Definition Audio Controller [C-1]
                  
      Offset 000:  86 80 20 1E  06 00 10 00  04 00 03 04  10 00 00 00 
      Offset 010:  04 00 11 F6  00 00 00 00  00 00 00 00  00 00 00 00 
      Offset 020:  00 00 00 00  00 00 00 00  00 00 00 00  43 10 45 84 
      Offset 030:  00 00 00 00  50 00 00 00  00 00 00 00  16 01 00 00 
      Offset 040:  01 00 00 05  00 00 00 00  00 00 00 00  00 00 00 00 
      Offset 050:  01 60 42 C8  00 00 00 00  00 00 00 00  00 00 00 00 
      Offset 060:  05 70 80 00  00 00 00 00  00 00 00 00  00 00 00 00 
      Offset 070:  10 00 91 00  00 00 00 10  00 08 10 00  00 00 00 00 
      Offset 080:  00 00 00 00  00 00 00 00  00 00 00 00  00 00 00 00 
      Offset 090:  00 00 00 00  00 00 00 00  00 00 00 00  00 00 00 00 
      Offset 0A0:  00 00 00 00  00 00 00 00  00 00 00 00  00 00 00 00 
      Offset 0B0:  00 00 00 00  00 00 00 00  00 00 00 00  00 00 00 00 
      Offset 0C0:  00 04 02 01  00 24 00 40  00 0C A3 82  10 00 33 02 
      Offset 0D0:  00 0C A3 02  10 00 33 02  00 00 00 00  00 00 00 00 
      Offset 0E0:  00 00 00 00  00 00 00 00  00 00 00 00  00 00 00 00 
      Offset 0F0:  00 00 00 00  00 00 00 00  87 0F 04 08  00 00 00 00 

    B00 D1C F00:  Intel Panther Point PCH - PCI Express Port 1
                  
      Offset 000:  86 80 10 1E  04 04 10 00  C4 00 04 06  10 00 81 00 
      Offset 010:  00 00 00 00  00 00 00 00  00 02 02 00  F0 00 00 20 
      Offset 020:  F0 FF 00 00  F1 FF 01 00  00 00 00 00  00 00 00 00 
      Offset 030:  00 00 00 00  40 00 00 00  00 00 00 00  0B 01 00 00 
      Offset 040:  10 80 42 01  00 80 00 00  00 00 10 00  42 4C 12 01 
      Offset 050:  00 00 01 18  00 FD 04 00  00 00 00 00  00 00 00 00 
      Offset 060:  00 00 00 00  16 00 00 00  00 00 00 00  00 00 00 00 
      Offset 070:  01 00 01 00  00 00 00 00  00 00 00 00  00 00 00 00 
      Offset 080:  05 90 00 00  00 00 00 00  00 00 00 00  00 00 00 00 
      Offset 090:  0D A0 00 00  43 10 CA 84  00 00 00 00  00 00 00 00 
      Offset 0A0:  01 00 02 C8  00 00 00 00  00 00 00 00  00 00 00 00 
      Offset 0B0:  00 00 00 00  00 00 00 00  00 00 00 00  00 00 00 00 
      Offset 0C0:  00 00 00 00  00 00 00 00  00 00 00 00  00 00 00 00 
      Offset 0D0:  00 00 00 01  02 0B 00 00  00 80 11 81  00 00 00 00 
      Offset 0E0:  00 3F 00 00  00 00 00 00  01 00 00 00  00 00 00 00 
      Offset 0F0:  00 00 00 00  00 00 00 00  87 0F 04 08  00 00 00 00 

    B00 D1C F04:  Intel Panther Point PCH - PCI Express Port 5
                  
      Offset 000:  86 80 18 1E  07 04 10 00  C4 00 04 06  10 00 81 00 
      Offset 010:  00 00 00 00  00 00 00 00  00 03 03 00  D0 D0 00 00 
      Offset 020:  F0 FF 00 00  11 EC 11 EC  00 00 00 00  00 00 00 00 
      Offset 030:  00 00 00 00  40 00 00 00  00 00 00 00  0B 01 00 00 
      Offset 040:  10 80 42 01  00 80 00 00  00 00 10 00  12 3C 12 05 
      Offset 050:  40 00 11 70  00 B2 24 00  00 00 40 00  00 00 00 00 
      Offset 060:  00 00 00 00  16 00 00 00  00 00 00 00  00 00 00 00 
      Offset 070:  02 00 01 00  00 00 00 00  00 00 00 00  00 00 00 00 
      Offset 080:  05 90 00 00  00 00 00 00  00 00 00 00  00 00 00 00 
      Offset 090:  0D A0 00 00  43 10 CA 84  00 00 00 00  00 00 00 00 
      Offset 0A0:  01 00 02 C8  00 00 00 00  00 00 00 00  00 00 00 00 
      Offset 0B0:  00 00 00 00  00 00 00 00  00 00 00 00  00 00 00 00 
      Offset 0C0:  00 00 00 00  00 00 00 00  00 00 00 00  00 00 00 00 
      Offset 0D0:  00 00 00 01  02 0B 00 00  00 80 11 81  00 00 00 00 
      Offset 0E0:  00 3F 00 00  00 00 00 00  01 00 00 00  00 00 00 00 
      Offset 0F0:  00 00 00 00  00 00 00 00  87 0F 04 08  00 00 00 00 

    B00 D1C F05:  Intel 82801EB I/O Controller Hub 5 (ICH5)
                  
      Offset 000:  86 80 4E 24  07 04 10 00  C4 01 04 06  10 00 81 00 
      Offset 010:  00 00 00 00  00 00 00 00  00 04 05 00  F0 00 00 20 
      Offset 020:  F0 FF 00 00  F1 FF 01 00  00 00 00 00  00 00 00 00 
      Offset 030:  00 00 00 00  40 00 00 00  00 00 00 00  0A 02 00 00 
      Offset 040:  10 80 42 01  00 80 00 00  00 00 10 00  12 4C 12 06 
      Offset 050:  00 00 11 30  00 B2 2C 00  00 00 40 00  00 00 00 00 
      Offset 060:  00 00 00 00  16 00 00 00  00 00 00 00  00 00 00 00 
      Offset 070:  02 00 01 00  00 00 00 00  00 00 00 00  00 00 00 00 
      Offset 080:  05 90 00 00  00 00 00 00  00 00 00 00  00 00 00 00 
      Offset 090:  0D A0 00 00  43 10 CA 84  00 00 00 00  00 00 00 00 
      Offset 0A0:  01 00 02 C8  00 00 00 00  00 00 00 00  00 00 00 00 
      Offset 0B0:  00 00 00 00  00 00 00 00  00 00 00 00  00 00 00 00 
      Offset 0C0:  00 00 00 00  00 00 00 00  00 00 00 00  00 00 00 00 
      Offset 0D0:  00 00 00 01  02 0B 00 00  00 80 11 81  00 00 00 00 
      Offset 0E0:  00 03 00 00  00 00 00 00  01 00 00 00  03 00 00 00 
      Offset 0F0:  00 00 00 00  00 00 00 00  87 0F 04 08  00 00 00 00 

    B00 D1D F00:  Intel Panther Point PCH - USB 2.0 EHCI Controller #1 [C-1]
                  
      Offset 000:  86 80 26 1E  06 00 90 02  04 20 03 0C  00 00 00 00 
      Offset 010:  00 60 11 F6  00 00 00 00  00 00 00 00  00 00 00 00 
      Offset 020:  00 00 00 00  00 00 00 00  00 00 00 00  43 10 CA 84 
      Offset 030:  00 00 00 00  50 00 00 00  00 00 00 00  17 01 00 00 
      Offset 040:  00 00 00 00  00 00 00 00  00 00 00 00  00 00 00 00 
      Offset 050:  01 58 C2 C9  00 00 00 00  0A 98 A0 20  00 00 00 00 
      Offset 060:  20 20 01 06  00 00 00 00  01 00 00 01  00 20 00 00 
      Offset 070:  00 00 FF 3F  00 00 00 00  00 00 00 00  00 00 00 00 
      Offset 080:  00 00 80 00  11 88 0C 93  30 0D 00 24  00 00 00 00 
      Offset 090:  00 00 00 00  00 00 00 00  13 00 06 03  00 00 00 00 
      Offset 0A0:  00 00 00 00  00 00 00 00  00 00 00 00  00 00 00 00 
      Offset 0B0:  00 00 00 00  00 00 00 00  00 00 00 00  00 00 00 00 
      Offset 0C0:  00 00 00 00  00 00 00 00  00 00 00 00  00 00 00 00 
      Offset 0D0:  00 00 00 00  00 AA FF 00  00 00 00 00  00 00 00 00 
      Offset 0E0:  00 00 00 00  24 01 C5 20  40 00 00 00  6C 6E 3B 08 
      Offset 0F0:  00 00 00 00  88 85 80 00  87 0F 04 08  08 17 5B 20 

    B00 D1F F00:  Intel H77 Chipset - LPC Interface Controller [C-1]
                  
      Offset 000:  86 80 4A 1E  07 00 10 02  04 00 01 06  00 00 80 00 
      Offset 010:  00 00 00 00  00 00 00 00  00 00 00 00  00 00 00 00 
      Offset 020:  00 00 00 00  00 00 00 00  00 00 00 00  43 10 CA 84 
      Offset 030:  00 00 00 00  E0 00 00 00  00 00 00 00  00 00 00 00 
      Offset 040:  01 04 00 00  80 00 00 00  01 05 00 00  10 00 00 00 
      Offset 050:  F8 00 00 00  00 00 00 00  00 00 00 00  00 00 00 00 
      Offset 060:  8B 8A 8B 8B  D0 00 00 00  80 83 83 8A  F8 F0 00 00 
      Offset 070:  78 F0 78 F0  78 F0 78 F0  78 F0 78 F0  78 F0 78 F0 
      Offset 080:  10 00 0E 3C  91 02 0C 00  00 00 00 00  00 00 00 00 
      Offset 090:  00 00 00 00  00 0F 00 00  00 00 00 00  00 00 00 00 
      Offset 0A0:  08 0E 80 00  09 18 06 00  00 47 00 00  00 00 01 00 
      Offset 0B0:  00 00 00 00  00 00 00 00  00 00 00 00  00 00 00 00 
      Offset 0C0:  00 00 00 00  00 00 00 00  00 00 00 00  00 00 00 00 
      Offset 0D0:  33 22 11 00  67 45 00 00  CF FF 00 00  08 00 00 00 
      Offset 0E0:  09 00 0C 10  00 00 00 00  B3 02 64 04  00 00 00 00 
      Offset 0F0:  01 C0 D1 FE  00 00 00 00  87 0F 04 08  00 00 00 00 

    B00 D1F F02:  Intel Panther Point PCH - SATA Controller [C-1]
                  
      Offset 000:  86 80 00 1E  05 00 B0 02  04 8F 01 01  00 00 00 00 
      Offset 010:  D1 F0 00 00  C1 F0 00 00  B1 F0 00 00  A1 F0 00 00 
      Offset 020:  91 F0 00 00  81 F0 00 00  00 00 00 00  43 10 CA 84 
      Offset 030:  00 00 00 00  70 00 00 00  00 00 00 00  13 02 00 00 
      Offset 040:  00 80 00 80  00 00 00 00  00 00 00 00  00 00 00 00 
      Offset 050:  00 00 00 00  00 00 00 00  00 00 00 00  00 00 00 00 
      Offset 060:  00 00 00 00  00 00 00 00  00 00 00 00  00 00 00 00 
      Offset 070:  01 B0 03 00  08 00 00 00  00 00 00 00  00 00 00 00 
      Offset 080:  05 70 00 00  00 00 00 00  00 00 00 00  00 00 00 00 
      Offset 090:  00 2C 03 83  83 01 00 2C  08 42 5C 01  00 00 00 00 
      Offset 0A0:  E0 00 00 00  39 00 39 00  00 00 00 00  00 00 00 00 
      Offset 0B0:  13 00 06 03  00 00 00 00  00 00 00 00  00 00 00 00 
      Offset 0C0:  00 00 00 00  05 00 00 00  00 00 00 00  00 00 00 00 
      Offset 0D0:  00 00 00 00  00 00 00 00  00 00 00 00  00 00 00 00 
      Offset 0E0:  00 00 00 00  00 00 00 00  00 00 00 00  00 00 00 00 
      Offset 0F0:  00 00 00 00  00 00 00 00  87 0F 04 08  00 00 00 00 

    B00 D1F F03:  Intel Panther Point PCH - SMBus Controller [C-1]
                  
      Offset 000:  86 80 22 1E  03 00 80 02  04 00 05 0C  00 00 00 00 
      Offset 010:  04 50 11 F6  00 00 00 00  00 00 00 00  00 00 00 00 
      Offset 020:  01 F0 00 00  00 00 00 00  00 00 00 00  43 10 CA 84 
      Offset 030:  00 00 00 00  00 00 00 00  00 00 00 00  0B 03 00 00 
      Offset 040:  01 00 00 00  00 00 00 00  00 00 00 00  00 00 00 00 
      Offset 050:  00 00 00 00  00 00 00 00  00 00 00 00  00 00 00 00 
      Offset 060:  03 04 04 00  00 00 08 08  00 00 00 00  00 00 00 00 
      Offset 070:  00 00 00 00  00 00 00 00  00 00 00 00  00 00 00 00 
      Offset 080:  04 00 00 00  00 00 00 00  00 00 00 00  00 00 00 00 
      Offset 090:  00 00 00 00  00 00 00 00  00 00 00 00  00 00 00 00 
      Offset 0A0:  00 00 00 00  00 00 00 00  00 00 00 00  00 00 00 00 
      Offset 0B0:  00 00 00 00  00 00 00 00  00 00 00 00  00 00 00 00 
      Offset 0C0:  00 00 00 00  00 00 00 00  00 00 00 00  00 00 00 00 
      Offset 0D0:  00 00 00 00  00 00 00 00  00 00 00 00  00 00 00 00 
      Offset 0E0:  00 00 00 00  00 00 00 00  00 00 00 00  00 00 00 00 
      Offset 0F0:  00 00 00 00  00 00 00 00  87 0F 04 08  00 00 00 00 

    B00 D1F F05:  Intel Panther Point PCH - SATA Controller (Ports 4-5) [C-1]
                  
      Offset 000:  86 80 08 1E  05 00 B0 02  04 85 01 01  00 00 00 00 
      Offset 010:  71 F0 00 00  61 F0 00 00  51 F0 00 00  41 F0 00 00 
      Offset 020:  31 F0 00 00  21 F0 00 00  00 00 00 00  43 10 CA 84 
      Offset 030:  00 00 00 00  70 00 00 00  00 00 00 00  13 02 00 00 
      Offset 040:  00 80 00 80  00 00 00 00  00 00 00 00  00 00 00 00 
      Offset 050:  00 00 00 00  00 00 00 00  00 00 00 00  00 00 00 00 
      Offset 060:  00 00 00 00  00 00 00 00  00 00 00 00  00 00 00 00 
      Offset 070:  01 B0 03 00  08 00 00 00  00 00 00 00  00 00 00 00 
      Offset 080:  00 00 00 00  00 00 00 00  00 00 00 00  00 00 00 00 
      Offset 090:  00 02 01 01  00 00 00 00  00 00 00 00  00 00 00 00 
      Offset 0A0:  00 00 00 00  00 00 00 00  00 00 00 00  00 00 00 00 
      Offset 0B0:  13 00 06 03  00 00 00 00  00 00 00 00  00 00 00 00 
      Offset 0C0:  00 00 00 00  00 00 00 00  00 00 00 00  00 00 00 00 
      Offset 0D0:  00 00 00 00  00 00 00 00  00 00 00 00  00 00 00 00 
      Offset 0E0:  00 00 00 00  00 00 00 00  00 00 00 00  00 00 00 00 
      Offset 0F0:  00 00 00 00  00 00 00 00  87 0F 04 08  00 00 00 00 

    B00 D1F F06:  Intel Panther Point PCH - Thermal Management Controller [C-1]
                  
      Offset 000:  86 80 24 1E  00 00 10 00  04 00 80 11  00 00 00 00 
      Offset 010:  04 00 00 00  00 00 00 00  00 00 00 00  00 00 00 00 
      Offset 020:  00 00 00 00  00 00 00 00  00 00 00 00  43 10 CA 84 
      Offset 030:  00 00 00 00  50 00 00 00  00 00 00 00  0B 03 00 00 
      Offset 040:  05 00 20 EC  00 00 00 00  00 00 00 00  00 00 00 00 
      Offset 050:  01 00 23 00  08 00 00 00  00 00 00 00  00 00 00 00 
      Offset 060:  00 00 00 00  00 00 00 00  00 00 00 00  00 00 00 00 
      Offset 070:  00 00 00 00  00 00 00 00  00 00 00 00  00 00 00 00 
      Offset 080:  05 00 00 00  00 00 00 00  00 00 00 00  00 00 00 00 
      Offset 090:  00 00 00 00  00 00 00 00  00 00 00 00  00 00 00 00 
      Offset 0A0:  00 00 00 00  00 00 00 00  00 00 00 00  00 00 00 00 
      Offset 0B0:  00 00 00 00  00 00 00 00  00 00 00 00  00 00 00 00 
      Offset 0C0:  00 00 00 00  00 00 00 00  00 00 00 00  00 00 00 00 
      Offset 0D0:  00 00 00 00  00 00 00 00  00 00 00 00  00 00 00 00 
      Offset 0E0:  00 00 00 00  00 00 00 00  00 00 00 00  00 00 00 00 
      Offset 0F0:  00 00 00 00  00 00 00 00  87 0F 04 08  00 00 00 00 

    B01 D00 F00:  nVIDIA GeForce GTX 550 Ti Video Adapter
                  
      Offset 000:  DE 10 44 12  07 00 10 00  A1 00 00 03  10 00 80 00 
      Offset 010:  00 00 00 F4  0C 00 00 E0  00 00 00 00  0C 00 00 E8 
      Offset 020:  00 00 00 00  01 E0 00 00  00 00 00 00  00 00 00 00 
      Offset 030:  00 00 00 00  60 00 00 00  00 00 00 00  10 01 00 00 
      Offset 040:  00 00 00 00  00 00 00 00  00 00 00 00  00 00 00 00 
      Offset 050:  01 00 00 00  01 00 00 00  CE D6 23 00  00 00 00 00 
      Offset 060:  01 68 03 00  08 00 00 00  05 78 80 00  00 00 00 00 
      Offset 070:  00 00 00 00  00 00 00 00  10 B4 02 00  A0 8D 2C 01 
      Offset 080:  10 29 00 00  01 2D 05 00  40 01 01 11  00 00 00 00 
      Offset 090:  00 00 00 00  00 00 00 00  00 00 00 00  10 00 00 00 
      Offset 0A0:  00 00 00 00  00 00 00 00  01 00 00 00  00 00 00 00 
      Offset 0B0:  00 00 00 00  09 00 14 01  00 00 00 00  00 00 00 00 
      Offset 0C0:  00 00 00 00  00 00 00 00  00 00 00 00  00 00 00 00 
      Offset 0D0:  00 00 00 00  00 00 00 00  00 00 00 00  00 00 00 00 
      Offset 0E0:  00 00 00 00  00 00 00 00  00 00 00 00  00 00 00 00 
      Offset 0F0:  00 00 00 00  00 00 00 00  00 00 00 00  00 00 00 00 

    B01 D00 F01:  nVIDIA GF116 - High Definition Audio Controller
                  
      Offset 000:  DE 10 EE 0B  06 00 10 00  A1 00 03 04  10 00 80 00 
      Offset 010:  00 00 08 F6  00 00 00 00  00 00 00 00  00 00 00 00 
      Offset 020:  00 00 00 00  00 00 00 00  00 00 00 00  00 00 00 00 
      Offset 030:  00 00 00 00  60 00 00 00  00 00 00 00  11 02 00 00 
      Offset 040:  00 00 00 00  00 00 00 00  00 00 00 00  00 00 00 00 
      Offset 050:  00 00 00 00  00 00 00 00  CE D6 23 00  00 00 00 00 
      Offset 060:  01 68 03 00  08 00 00 00  05 78 80 00  00 00 00 00 
      Offset 070:  00 00 00 00  00 00 00 00  10 00 02 00  A0 8D 2C 01 
      Offset 080:  00 28 01 00  01 2D 05 00  48 01 01 11  00 00 00 00 
      Offset 090:  00 00 00 00  00 00 00 00  00 00 00 00  10 00 00 00 
      Offset 0A0:  00 00 00 00  00 00 00 00  00 00 00 00  00 00 00 00 
      Offset 0B0:  00 00 00 00  00 00 00 00  00 00 00 00  00 00 00 00 
      Offset 0C0:  00 00 00 00  00 00 00 00  00 00 00 00  00 00 00 00 
      Offset 0D0:  00 00 00 00  00 00 00 00  00 00 00 00  00 00 00 00 
      Offset 0E0:  00 00 00 00  00 00 00 00  00 00 00 00  00 00 00 00 
      Offset 0F0:  00 00 00 00  00 00 00 00  00 00 00 00  00 00 00 00 

    B03 D00 F00:  Realtek RTL8168/8111 PCI-E Gigabit Ethernet Adapter
                  
      Offset 000:  EC 10 68 81  07 04 10 00  09 00 00 02  10 00 00 00 
      Offset 010:  01 D0 00 00  00 00 00 00  0C 40 10 EC  00 00 00 00 
      Offset 020:  0C 00 10 EC  00 00 00 00  00 00 00 00  43 10 05 85 
      Offset 030:  00 00 00 00  40 00 00 00  00 00 00 00  00 01 00 00 
      Offset 040:  01 50 C3 FF  08 00 00 00  00 00 00 00  00 00 00 00 
      Offset 050:  05 70 80 00  00 00 00 00  00 00 00 00  00 00 00 00 
      Offset 060:  00 00 00 00  00 00 00 00  00 00 00 00  00 00 00 00 
      Offset 070:  10 B0 02 02  C0 8C 90 05  00 50 10 00  11 7C 07 00 
      Offset 080:  40 00 11 10  00 00 00 00  00 00 00 00  00 00 00 00 
      Offset 090:  00 00 00 00  1F 00 00 00  10 00 00 00  00 00 00 00 
      Offset 0A0:  00 00 00 00  00 00 00 00  00 00 00 00  00 00 00 00 
      Offset 0B0:  11 D0 03 80  04 00 00 00  04 08 00 00  00 00 00 00 
      Offset 0C0:  00 00 00 00  00 00 00 00  00 00 00 00  00 00 00 00 
      Offset 0D0:  03 00 00 00  00 00 00 00  00 00 00 00  00 00 00 00 
      Offset 0E0:  00 00 00 00  00 00 00 00  00 00 00 00  00 00 00 00 
      Offset 0F0:  00 00 00 00  00 00 00 00  00 00 00 00  00 00 00 00 

    B04 D00 F00:  ASMedia ASM1083 PCI-E to PCI Bridge Controller
                  
      Offset 000:  21 1B 80 10  07 04 10 00  03 01 04 06  10 00 01 00 
      Offset 010:  00 00 00 00  00 00 00 00  04 05 05 20  F1 01 20 20 
      Offset 020:  F0 FF 00 00  F1 FF 01 00  00 00 00 00  00 00 00 00 
      Offset 030:  00 00 00 00  C0 00 00 00  00 00 00 00  0A 01 00 00 
      Offset 040:  60 60 00 00  00 07 00 00  00 00 00 00  A7 27 00 00 
      Offset 050:  00 00 00 00  00 00 00 00  00 00 00 00  00 00 00 00 
      Offset 060:  00 00 00 00  00 00 00 00  00 00 00 00  00 00 00 00 
      Offset 070:  00 00 00 00  00 00 00 00  00 00 00 00  00 00 00 00 
      Offset 080:  00 00 00 00  00 00 00 00  00 00 00 00  00 00 00 00 
      Offset 090:  00 00 00 00  00 00 00 00  00 00 00 00  00 00 00 00 
      Offset 0A0:  00 00 00 00  00 00 00 00  00 00 00 00  00 00 00 00 
      Offset 0B0:  00 00 00 00  00 00 00 00  00 00 00 00  00 00 00 00 
      Offset 0C0:  0D 00 00 00  43 10 89 84  00 00 00 00  00 00 00 00 
      Offset 0D0:  00 00 00 00  00 00 00 00  00 00 00 00  00 00 00 00 
      Offset 0E0:  00 00 00 00  00 00 00 00  00 00 00 00  00 00 00 00 
      Offset 0F0:  00 00 00 00  00 00 00 00  00 00 00 00  00 00 00 00 

    PCI-8086-0100:  Intel SNB/IVB/HSW/CRW/BDW/SKL/KBL MCHBAR @ FED10000h
                  
      Offset 4000:  99 79 18 00  54 54 14 8A  20 22 02 0A  90 56 00 00 
      Offset 4010:  00 00 00 00  00 00 00 00  00 00 00 00  00 00 00 00 
      Offset 4020:  05 00 10 00  24 24 24 20  11 01 0E 00  00 00 00 00 

    PCI-8086-0100:  Intel SNB/IVB/HSW/CRW/BDW/SKL/KBL MCHBAR @ FED10000h
                  
      Offset 4280:  00 00 00 00  00 00 0C 00  00 00 00 00  44 00 00 00 
      Offset 4290:  80 40 00 00  0F 98 00 00  50 14 6B 5A  D0 44 00 00 
      Offset 42A0:  07 10 00 00  00 72 F9 41  00 00 00 00  01 00 00 00 

    PCI-8086-0100:  Intel SNB/IVB/HSW/CRW/BDW/SKL/KBL MCHBAR @ FED10000h
                  
      Offset 4400:  99 79 18 00  54 54 14 8A  20 22 02 0A  90 56 00 00 
      Offset 4410:  00 00 00 00  00 00 00 00  00 00 00 00  00 00 00 00 
      Offset 4420:  05 00 10 00  24 24 24 20  11 01 0E 00  00 00 00 00 

    PCI-8086-0100:  Intel SNB/IVB/HSW/CRW/BDW/SKL/KBL MCHBAR @ FED10000h
                  
      Offset 4680:  00 00 00 00  00 00 0C 00  00 00 00 00  44 00 00 00 
      Offset 4690:  80 40 00 00  0F 98 00 00  50 14 6B 5A  D0 44 00 00 
      Offset 46A0:  07 10 00 00  00 72 F9 41  00 00 00 00  01 00 00 00 

    PCI-8086-0100:  Intel SNB/IVB/HSW/CRW/BDW/SKL/KBL MCHBAR @ FED10000h
                  
      Offset 4800:  00 00 00 00  00 00 00 00  00 00 00 00  00 00 00 00 
      Offset 4810:  00 00 00 00  00 00 00 00  00 00 00 00  00 00 00 00 

    PCI-8086-0100:  Intel SNB/IVB/HSW/CRW/BDW/SKL/KBL MCHBAR @ FED10000h
                  
      Offset 4A80:  00 00 00 00  00 00 00 00  00 00 00 00  00 00 00 00 
      Offset 4A90:  00 00 00 00  00 00 00 00  00 00 00 00  00 00 00 00 

    PCI-8086-0100:  Intel SNB/IVB/HSW/CRW/BDW/SKL/KBL MCHBAR @ FED10000h
                  
      Offset 5000:  24 00 00 00  10 08 62 00  10 08 62 00  00 00 60 00 
      Offset 5010:  00 00 00 00  00 00 30 18  00 00 00 00  00 00 00 00 

    PCI-8086-0100:  Intel SNB/IVB/HSW/CRW/BDW/SKL/KBL MCHBAR @ FED10000h
                  
      Offset 5880:  E7 71 91 CA  00 00 00 00  D0 DA E4 00  00 00 00 00 
      Offset 5890:  8E 4F 6B 04  B3 4C 0B 04  00 00 00 00  00 00 00 00 
      Offset 58A0:  00 00 00 00  00 00 00 00  00 00 00 00  00 00 00 00 
      Offset 58B0:  00 00 00 00  00 00 00 00  00 00 00 00  00 00 00 00 
      Offset 58C0:  00 00 00 00  00 00 00 00  00 00 00 00  00 00 00 00 
      Offset 58D0:  00 00 00 00  00 00 00 00  00 00 00 00  00 00 00 00 
      Offset 58E0:  00 00 00 00  00 00 00 00  00 00 00 00  00 00 00 00 
      Offset 58F0:  00 00 00 00  00 00 00 00  00 00 00 00  00 00 00 00 
      Offset 5900:  00 00 00 00  00 00 00 00  00 00 00 00  00 00 00 00 
      Offset 5910:  00 00 00 00  00 00 00 00  00 00 00 00  00 00 00 00 
      Offset 5920:  00 00 00 00  10 00 00 00  B9 24 9B 98  CC 7E 3B 01 
      Offset 5930:  F8 02 E0 01  C0 03 0A 00  03 10 0A 00  3A C6 15 CF 
      Offset 5940:  00 00 00 00  00 00 00 00  00 00 00 00  00 00 00 00 
      Offset 5950:  00 00 00 00  00 00 04 00  00 1F 01 60  00 10 00 00 
      Offset 5960:  00 00 00 00  07 68 13 04  8C 5E 13 04  51 61 28 4E 
      Offset 5970:  00 00 00 00  00 00 00 00  32 00 00 00  32 00 00 00 
      Offset 5980:  2A 00 00 00  EB 87 A6 6F  00 00 00 00  00 00 00 00 
      Offset 5990:  FF 00 00 00  FF 00 00 00  16 11 11 00  00 13 63 00 
      Offset 59A0:  00 00 00 00  00 00 00 00  00 00 00 00  00 00 00 00 
      Offset 59B0:  0C 03 00 80  94 14 14 18  04 01 00 80  94 14 14 18 
      Offset 59C0:  00 00 3A 88  00 00 00 00  00 00 00 00  00 00 00 00 

    PCI-8086-0100:  Intel SNB/IVB/HSW/CRW/BDW/SKL/KBL MCHBAR @ FED10000h
                  
      Offset 5E00:  05 00 00 00  05 00 00 00  00 00 00 00  00 00 00 00 
      Offset 5E10:  00 00 00 00  00 00 00 00  00 00 00 00  00 00 00 00 

    PCI-8086-1E24:  Intel 5/6/7/8/9/10-series PCH TBARB @ EC200000h
                  
      Offset 00:  00 BA 00 F8  2B 3A 00 00  84 04 7C 00  00 00 C0 00 
      Offset 10:  00 00 C0 18  87 DE 8C 80  00 00 E0 10  00 00 00 00 
      Offset 20:  00 00 83 0C  00 00 00 00  00 00 00 00  00 00 00 00 
      Offset 30:  00 80 00 00  00 00 00 00  00 00 00 00  00 00 00 80 
      Offset 40:  00 02 00 FF  00 00 00 00  00 00 00 00  00 00 00 00 
      Offset 50:  00 00 00 00  00 00 00 00  00 00 00 00  00 00 00 00 
      Offset 60:  00 00 00 00  00 00 00 00  00 00 00 00  20 1B 16 05 
      Offset 70:  00 00 00 00  00 00 00 00  00 00 00 00  00 00 00 00 
      Offset 80:  00 00 00 04  79 79 00 FF  00 00 00 00  00 00 00 00 
      Offset 90:  39 65 89 29  00 00 00 00  00 00 00 00  00 00 00 00 
      Offset A0:  00 00 00 00  00 00 00 00  00 00 00 00  00 00 00 00 
      Offset B0:  00 00 00 00  00 00 00 00  00 00 00 00  00 00 00 00 
      Offset C0:  00 00 00 00  00 00 00 FF  00 00 00 00  00 00 00 00 
      Offset D0:  00 00 00 00  00 00 00 00  2F 00 8D 00  00 00 00 00 
      Offset E0:  00 00 00 00  00 00 00 00  00 00 00 00  00 00 00 00 
      Offset F0:  00 00 00 00  00 00 00 00  00 00 00 00  00 00 00 00 


--------[ Debug - Video BIOS ]------------------------------------------------------------------------------------------

    C000:0000  U.l.K7400.L.w.VIDEO ......<...IBM VGA Compatible......eO02/22/11
    C000:0040  ..........@.}.....*......#..P..........8....C..CPMIDl.o.......
    C000:0080  .....3GeForce GTX 550 Ti VGA BIOS...............................
    C000:00C0  .......................Version 70.26.20.00.00 ...Copyright (C) 1
    C000:0100  996-2011 NVIDIA Corp..............BIOS-P/N@N8129................
    C000:0140  .....Chip Rev   ................................................
    C000:0180  ........PCIR..D.........l.......HYB$..BIT......E2...,.B.!.8.C...
    C000:01C0  Y.D...g.A...k.I...n.L.....M.....N.....P.0...S.....T.....U.....V.
    C000:0200  ....x.....d.....p.....i.B.....>.TI.[.b_.................. &p....
    C000:0240  ..............\\....0............8J.....M.@....K.K.K.K9M.M.K...M
    C000:0280  ...!J.J.g...g...K...b..Jc..Re...f..8g......|g..K....f...f...g...
    C000:02C0  g....P.....(TI.hI#".#E..ON.I..J.I...........B.[.[............ &p
    C000:0300  ...........02/16/11..........=..............400.10500000........
    C000:0340  ........Z.S..................[ .........Z.S.........,......[1.y.
    C000:0380  y...5.y...........6.6.G.....L.q.@...Q...Z.......!.x...y.y...y.y.
    C000:03C0  ....a.y.....f...............n.....q.....t.e.$.q.x.S.z...........


--------[ Debug - Unknown ]---------------------------------------------------------------------------------------------

    HDD             ADATA SU635 ATA Device


------------------------------------------------------------------------------------------------------------------------

The names of actual companies and products mentioned herein may be the trademarks of their respective owners.
